titleid,titlename,description,genre,releaseyear,runtimeminutes
130,Metropolis,"In a futuristic city sharply divided between the working class and the city planners, the son of the city''s masterd falls in love with a working-class prophet who predicts the cog of a savior to mediate their differences.","Drama, Sci-Fi",1927,153
131,The Kid,"The Tramp cares for an abandoned child, but events put that relationship in jeopardy.","Comedy, Drama, Family",1921,68
132,Chhichhore,"A tragic incident forces Anirudh, a middle-aged man, to take a trip down memory lane and reisce his college days along with his friends, who were labelled as losers.","Comedy, Drama",2019,143
133,Uri: The Surgical Strike,"Indian army special forces execute a covert operation, avenging the killing of fellow army men at their base by a terrorist group.","Action, Drama, War",2018,138
134,K.G.F: Chapter 1,"In the 1970s, a fierce rebel rises against brutal oppression and becomes the symbol of hope to legions of downtrodden people.","Action, Drama",2018,156
135,Green Book,A working-class Italian-American bouncer becomes the driver of an African-American classical pianist on a tour of venues through the 1960s American South.,"Biography, Comedy, Drama",2018,130
136,"Three Billboards Outside Ebbing, Missouri",A mother personally challenges the local authorities to solve her daughter's murder when they fail to catch the culprit.,"Comedy, Crime, Drama",2017,115
137,Talvar,An experienced investigator confronts several conflicting theories about the perpetrators of a violent double homicide.,"Crime, Drama, Mystery",2015,132
138,Baahubali 2: The Conclusion,"When Shiva, the son of Bahubali, learns about his heritage, he begins to look for answers. His story is juxtaposed with past events that unfolded in the Mahishmati Kingdom.","Action, Drama",2017,167
139,Klaus,"A simple act of kindness always sparks another, even in a frozen, faraway place. When Smeerensburg''s new postman, Jesper, befriends toymaker Klaus, their gifts melt an age-old feud and deliver a sleigh full of holiday traditions.","Animation, Adventure, Comedy",2019,96
140,Drishyam,"Desperate measures are taken by a man who tries to save his family from the dark side of the law, after they commit an unexpected crime.","Crime, Drama, Mystery",2015,163
141,Queen,A Delhi girl from a traditional family sets out on a solo honeymoon after her marriage gets cancelled.,"Adventure, Comedy, Drama",2013,146
142,Mandariinid,"In 1992, war rages in Abkhazia, a breakaway region of Georgia. An Estonian man Ivo has decided to stay behind and harvest his crops of tangerines. In a bloody conflict at his door, a wounded man is left behind, and Ivo takes him in.","Drama, War",2013,87
143,Bhaag Milkha Bhaag,The truth behind the ascension of Milkha Singh who was scarred because of the India-Pakistan partition.,"Biography, Drama, Sport",2013,186
144,Gangs of Wasseypur,"A clash between Sultan and Shahid Khan leads to the expulsion of Khan from Wasseypur, and ignites a deadly blood feud spanning three generations.","Action, Comedy, Crime",2012,321
145,Udaan,"Expelled from his school, a 16-year old boy returns home to his abusive and oppressive father.",Drama,2010,134
146,Paan Singh Tomar,"The story of Paan Singh Tomar, an Indian athlete and seven-time national steeplechase champion who becomes one of the most feared dacoits in Chambal Valley after his retirement.","Action, Biography, Crime",2012,135
147,El secreto de sus ojos,A retired legal counselor writes a novel hoping to find closure for one of his past unresolved homicide cases and for his unreciprocated love with his superior - both of which still haunt him decades later.,"Drama, Mystery, Romance",2009,129
148,Warrior,"The youngest son of an alcoholic former boxer returns home, where he''s trained by his father for competition in a mixed martial arts tournament - a path that puts the fighter on a collision course with his estranged, older brother.","Action, Drama, Sport",2011,140
149,Shutter Island,"In 1954, a U.S. Marshal investigates the disappearance of a murderer who escaped from a hospital for the crially insane.","Mystery, Thriller",2010,138
150,Up,"78-year-old Carl Fredricksen travels to Paradise Falls in his house equipped with balloons, inadvertently taking a young stowaway.","Animation, Adventure, Comedy",2009,96
151,The Wolf of Wall Street,"Based on the true story of Jordan Belfort, from his rise to a wealthy stock-broker living the high life to his fall involving crime, corruption and the federal government.","Biography, Crime, Drama",2013,180
152,Chak De! India,Kabir Khan is the coach of the Indian Women's National Hockey Team and his dream is to make his all girls team emerge victorious against all odds.,"Drama, Family, Sport",2007,153
153,There Will Be Blood,"A story of family, religion, hatred, oil and madness, focusing on a turn-of-the-century prospector in the early days of the business.",Drama,2007,158
154,Pan's Labyrinth,"In the Falangist Spain of 1944, the bookish young stepdaughter of a sadistic army officer escapes into an eerie but captivating fantasy world.","Drama, Fantasy, War",2006,118
155,Toy Story 3,"The toys are mistakenly delivered to a day-care center instead of the attic right before Andy leaves for college, and it''s up to Woody to convince the other toys that they weren''t abandoned and to return home.","Animation, Adventure, Comedy",2010,103
156,V for Vendetta,"In a future British tyranny, a shadowy freedom fighter, known only by the alias of V, plots to overthrow it with the help of a young woman.","Action, Drama, Sci-Fi",2005,132
157,Rang De Basanti,"The story of six young Indians who assist an English woman to film a documentary on the freedom fighters from their past, and the events that lead them to relive the long-forgotten saga of freedom.","Comedy, Crime, Drama",2006,167
158,Black,"The cathartic tale of a young woman who can''t see, hear or talk and the teacher who brings a ray of light into her dark world.",Drama,2005,122
159,Batman Begins,"After training with his mentor, Batman begins his fight to free crime-ridden Gotham City from corruption.","Action, Adventure",2005,140
160,"Swades: We, the People",A successful Indian scientist returns to an Indian village to take his nanny to America with him and in the process rediscovers his roots.,Drama,2004,210
161,Der Untergang,"Traudl Junge, the final secretary for Adolf Hitler, tells of the Nazi dictator''s final days in his Berlin bunker at the end of WWII.","Biography, Drama, History",2004,156
162,Hauru no ugoku shiro,"When an unconfident young woman is cursed with an old body by a spiteful witch, her only chance of breaking the spell lies with a self-indulgent yet insecure young wizard and his companions in his legged, walking castle.","Animation, Adventure, Family",2004,119
163,A Beautiful d,"After John Nash, a brilliant but asocial mathematician, accepts secret work in cryptography, his life takes a turn for the nightmarish.","Biography, Drama",2001,135
164,Hera Pheri,"Three unemployed men look for answers to all their money problems - but when their opportunity arrives, will they know what to do with it?","Action, Comedy, Crime",2000,156
165,"Lock, Stock and Two Smoking Barrels","A botched card game in London triggers four friends, thugs, weed-growers, hard gangsters, loan sharks and debt collectors to collide with each other in a series of unexpected events, all for the sake of weed, cash and two antique shotguns.","Action, Comedy, Crime",1998,107
166,L.A. Confidential,"As corruption grows in 1950s Los Angeles, three policemen - one strait-laced, one brutal, and one sleazy - investigate a series of murders with their own brand of justice.","Crime, Drama, Mystery",1997,138
167,Eskiya,"Baran the Bandit, released from prison after 35 years, searches for vengeance and his lover.","Crime, Drama, Thriller",1996,128
168,Heat,A group of professional bank robbers start to feel the heat from police when they unknowingly leave a clue at their latest heist.,"Crime, Drama, Thriller",1995,170
169,Casino,"A tale of greed, deception, money, power, and murder occur between two best friends: a mafia enforcer and a casino executive compete against each other over a gambling empire, and over a fast-living and fast-loving socialite.","Crime, Drama",1995,178
170,Andaz Apna Apna,Two slackers competing for the affections of an heiress inadvertently become her protectors from an evil crial.,"Action, Comedy, Romance",1994,160
171,Unforgiven,"Retired Old West gunslinger William Munny reluctantly takes on one last job, with the help of his old partner Ned Logan and a young man, The Schofield Kid.","Drama, Western",1992,130
172,Indiana Jones and the Last Crusade,"In 1938, after his father Professor Henry Jones, Sr. goes missing while pursuing the Holy Grail, Professor Henry Indiana Jones, Jr. finds himself up against Adolf Hitler''s Nazis again to stop them from obtaining its powers.","Action, Adventure",1989,127
245,Kill Bill: Vol. 1,"After awakening from a four-year coma, a former assassin wreaks vengeance on the team of assassins who betrayed her.","Action, Crime, Drama",2003,111
173,Dom za vesanje,"In this luous tale set in the area around Sarajevo and in Italy, Perhan, an engaging young Romany (gypsy) with telekinetic powers, is seduced by the quick-cash world of petty crime, which threatens to destroy him and those he loves.","Comedy, Crime, Drama",1988,142
174,Tonari no Totoro,"When two girls move to the country to be near their ailing mother, they have adventures with the wondrous forest spirits who live nearby.","Animation, Family, Fantasy",1988,86
175,Die Hard,An NYPD officer tries to save his wife and several others taken hostage by German terrorists during a Christmas party at the Nakatomi Plaza in Los Angeles.,"Action, Thriller",1988,132
176,Ran,"In Medieval Japan, an elderly warlord retires, handing over his empire to his three sons. However, he vastly underestimates how the new-found power will corrupt them and cause them to turn on each other...and him.","Action, Drama, War",1985,162
177,Raging Bull,"The life of boxer Jake LaMotta, whose violence and temper that led him to the top in the ring destroyed his life outside of it.","Biography, Drama, Sport",1980,129
178,Stalker,A guide leads two men through an area known as the Zone to find a room that grants wishes.,"Drama, Sci-Fi",1979,162
179,Höstsonaten,"A married daughter who longs for her mother''s love is visited by the latter, a successful concert pianist.","Drama, Music",1978,99
180,The Message,This epic historical drama chronicles the life and times of Prophet Muhammad and serves as an introduction to early Islamic history.,"Biography, Drama, History",1976,177
181,Sholay,"After his family is murdered by a notorious and ruthless bandit, a former police officer enlists the services of two outlaws to capture the bandit.","Action, Adventure, Comedy",1975,204
182,Monty Python and the Holy Grail,"King Arthur and his Knights of the Round Table embark on a surreal, low-budget search for the Holy Grail, encountering many, very silly obstacles.","Adventure, Comedy, Fantasy",1975,91
183,The Great Escape,Allied prisoners of war plan for several hundred of their number to escape from a German camp during World War II.,"Adventure, Drama, History",1963,172
184,To Kill a Mockingbird,"Atticus Finch, a lawyer in the Depression-era South, defends a black man against an undeserved rape charge, and his children against prejudice.","Crime, Drama",1962,129
185,Yôjinbô,A crafty ronin comes to a town divided by two crial gangs and decides to play them against each other to free the town.,"Action, Drama, Thriller",1961,110
186,Judgment at Nuremberg,"In 1948, an American court in occupied Germany tries four Nazis judged for war crimes.","Drama, War",1961,179
187,Some Like It Hot,"After two male musicians witness a mob hit, they flee the state in an all-female band disguised as women, but further complications set in.","Comedy, Music, Romance",1959,121
188,Smultronstället,"After living a life marked by coldness, an aging professor is forced to confront the emptiness of his existence.","Drama, Romance",1957,91
189,Det sjunde inseglet,"A man seeks answers about life, death, and the existence of God as he plays chess against the Grim Reaper during the Black Plague.","Drama, Fantasy, History",1957,96
190,Du rififi chez les hommes,"Four men plan a technically perfect crime, but the human element intervenes...","Crime, Drama, Thriller",1955,118
191,Dial M for Murder,A former tennis player tries to arrange his wife's murder after learning of her affair.,"Crime, Thriller",1954,105
192,Tôkyô monogatari,"An old couple visit their children and grandchildren in the city, but receive little attention.",Drama,1953,136
193,Rashômon,"The rape of a bride and the murder of her samurai husband are recalled from the perspectives of a bandit, the bride, the samurai''s ghost and a woodcutter.","Crime, Drama, Mystery",1950,88
194,All About Eve,A seegly timid but secretly ruthless ingénue insinuates herself into the lives of an aging Broadway star and her circle of theater friends.,Drama,1950,138
195,The Treasure of the Sierra Madre,Two Americans searching for work in Mexico convince an old prospector to help them e for gold in the Sierra Madre Mountains.,"Adventure, Drama, Western",1948,126
196,To Be or Not to Be,"During the Nazi occupation of Poland, an acting troupe becomes embroiled in a Polish soldier''s efforts to track down a German spy.","Comedy, War",1942,99
197,The Gold Rush,A prospector goes to the Klondike in search of gold and finds it and more.,"Adventure, Comedy, Drama",1925,95
198,Sherlock Jr.,"A film projectionist longs to be a detective, and puts his meagre skills to work when he is framed by a rival for stealing his girlfriend''s father''s pocketwatch.","Action, Comedy, Romance",1924,45
199,Portrait de la jeune fille en feu,"On an isolated island in Brittany at the end of the eighteenth century, a female painter is obliged to paint a wedding portrait of a young woman.","Drama, Romance",2019,122
200,Pink,"When three young women are implicated in a crime, a retired lawyer steps forward to help them clear their names.","Drama, Thriller",2016,136
201,Koe no katachi,"A young man is ostracized by his classmates after he bullies a deaf girl to the point where she moves away. Years later, he sets off on a path for redemption.","Animation, Drama, Family",2016,130
202,Contratiempo,A successful entrepreneur accused of murder and a witness preparation expert have less than three hours to come up with an impregnable defense.,"Crime, Drama, Mystery",2016,106
203,Ah-ga-ssi,"A woman is hired as a handmaiden to a Japanese heiress, but secretly she is involved in a plot to defraud her.","Drama, Romance, Thriller",2016,145
204,Mommy,"A widowed single mother, raising her violent son alone, finds new hope when a mysterious neighbor inserts herself into their household.",Drama,2014,139
205,Haider,"A young man returns to Kashmir after his father''s disappearance to confront his uncle, whom he suspects of playing a role in his father''s fate.","Action, Crime, Drama",2014,160
206,Logan,"In a future where mutants are nearly extinct, an elderly and weary Logan leads a quiet life. But when Laura, a mutant child pursued by scientists, comes to him for help, he must get her to safety.","Action, Drama, Sci-Fi",2017,137
207,Room,"Held captive for 7 years in an enclosed space, a woman and her young son finally gain their freedom, allowing the boy to experience the outside world for the first time.","Drama, Thriller",2015,118
208,Relatos salvajes,Six short stories that explore the extremities of human behavior involving people in distress.,"Comedy, Drama, Thriller",2014,122
209,Soul,"After landing the gig of a lifetime, a New York jazz pianist suddenly finds himself trapped in a strange land between Earth and the afterlife.","Animation, Adventure, Comedy",2020,100
210,Kis Uykusu,A hotel owner and landlord in a remote Turkish village deals with conflicts within his family and a tenant behind on his rent.,Drama,2014,196
211,PK,An alien on Earth loses the only device he can use to communicate with his spaceship. His innocent nature and child-like questions force the country to evaluate the impact of religion on its people.,"Comedy, Drama, Musical",2014,153
212,OMG: Oh My God!,A shopkeeper takes God to court when his shop is destroyed by an earthquake.,"Comedy, Drama, Fantasy",2012,125
213,The Grand Budapest Hotel,"A writer encounters the owner of an aging high-class hotel, who tells him of his early years serving as a lobby boy in the hotel''s glorious years under an exceptional concierge.","Adventure, Comedy, Crime",2014,99
214,Gone Girl,"With his wife''s disappearance having become the focus of an intense media circus, a man sees the spotlight turned on him when it''s suspected that he may not be innocent.","Drama, Mystery, Thriller",2014,149
215,Ôkami kodomo no Ame to Yuki,"After her werewolf lover unexpectedly dies in an accident while hunting for food for their children, a young woman must find ways to raise the werewolf son and daughter that she had with him while keeping their trait hidden from society.","Animation, Drama, Fantasy",2012,117
216,Hacksaw Ridge,"World War II American Army Medic Desmond T. Doss, who served during the Battle of Okinawa, refuses to kill people, and becomes the first man in American history to receive the Medal of Honor without firing a shot.","Biography, Drama, History",2016,139
217,Inside Out,"After young Riley is uprooted from her Midwest life and moved to San Francisco, her emotions - Joy, Fear, Anger, Disgust and Sadness - conflict on how best to navigate a new city, house, and school.","Animation, Adventure, Comedy",2015,95
218,Barfi!,Three young people learn that love can neither be defined nor contained by society's definition of normal and abnormal.,"Comedy, Drama, Romance",2012,151
219,12 Years a Slave,"In the antebellum United States, Solomon Northup, a free black man from upstate New York, is abducted and sold into slavery.","Biography, Drama, History",2013,134
220,Rush,The merciless 1970s rivalry between Formula One rivals James Hunt and Niki Lauda.,"Action, Biography, Drama",2013,123
221,Ford v Ferrari,American car designer Carroll Shelby and driver Ken Miles battle corporate interference and the laws of physics to build a revolutionary race car for Ford in order to defeat Ferrari at the 24 Hours of Le Mans in 1966.,"Action, Biography, Drama",2019,152
222,Spotlight,"The true story of how the Boston Globe uncovered the massive scandal of child molestation and cover-up within the local Catholic Archdiocese, shaking the entire Catholic Church to its core.","Biography, Crime, Drama",2015,129
223,Song of the Sea,"Ben, a young Irish boy, and his little sister Saoirse, a girl who can turn into a seal, go on an adventure to free the fairies and save the spirit world.","Animation, Adventure, Drama",2014,93
224,Kahaani,"A pregnant woman''s search for her missing husband takes her from London to Kolkata, but everyone she questions denies having ever met him.","Mystery, Thriller",2012,122
225,Zindagi Na Milegi Dobara,Three friends decide to turn their fantasy vacation into reality after one of their friends gets engaged.,"Comedy, Drama",2011,155
226,Prisoners,"When Keller Dover''s daughter and her friend go missing, he takes matters into his own hands as the police pursue multiple leads and the pressure mounts.","Crime, Drama, Mystery",2013,153
227,Mad Max: Fury Road,"In a post-apocalyptic wasteland, a woman rebels against a tyrannical ruler in search for her homeland with the aid of a group of female prisoners, a psychotic worshiper, and a drifter named Max.","Action, Adventure, Sci-Fi",2015,120
228,A Wednesday,A retiring police officer reisces about the most astounding day of his career. About a case that was never filed but continues to haunt him in his memories - the case of a man and a Wednesday.,"Action, Crime, Drama",2008,104
229,Gran Torino,"Disgruntled Korean War veteran Walt Kowalski sets out to reform his neighbor, Thao Lor, a Hmong teenager who tried to steal Kowalski''s prized possession: a 1972 Gran Torino.",Drama,2008,116
230,Harry Potter and the Deathly Hallows: Part 2,"Harry, Ron, and Hermione search for Voldemort''s remaining Horcruxes in their effort to destroy the Dark Lord as the final battle rages on at Hogwarts.","Adventure, Drama, Fantasy",2011,130
231,Okuribito,A newly unemployed cellist takes a job preparing the dead for funerals.,"Drama, Music",2008,130
232,Hachi: A Dog's Tale,A college professor bonds with an abandoned dog he takes into his home.,"Biography, Drama, Family",2009,93
233,Mary and Max,"A tale of friendship between two unlikely pen pals: Mary, a lonely, eight-year-old girl living in the suburbs of Melbourne, and Max, a forty-four-year old, severely obese man living in New York.","Animation, Comedy, Drama",2009,92
234,How to Train Your Dragon,"A hapless young Viking who aspires to hunt dragons becomes the unlikely friend of a young dragon himself, and learns there may be more to the creatures than he assumed.","Animation, Action, Adventure",2010,98
235,Into the Wild,"After graduating from Emory University, top student and athlete Christopher McCandless abandons his possessions, gives his entire $24,000 savings account to charity and hitchhikes to Alaska to live in the wilderness. Along the way, Christopher encounters a series of characters that shape his life.","Adventure, Biography, Drama",2007,148
236,No Country for Old Men,Violence and mayhem ensue after a hunter stumbles upon a drug deal gone wrong and more than two million dollars in cash near the Rio Grande.,"Crime, Drama, Thriller",2007,122
237,Lage Raho Munna Bhai,Munna Bhai embarks on a journey with Mahatma Gandhi in order to fight against a corrupt property dealer.,"Comedy, Drama, Romance",2006,144
238,Million Dollar Baby,A detered woman works with a hardened boxing trainer to become a professional.,"Drama, Sport",2004,132
239,Hotel Rwanda,"Paul Rusesabagina, a hotel manager, houses over a thousand Tutsi refugees during their struggle against the Hutu militia in Rwanda, Africa.","Biography, Drama, History",2004,121
240,Taegukgi hwinalrimyeo,"When two brothers are forced to fight in the Korean War, the elder decides to take the riskiest missions if it will help shield the younger from battle.","Action, Drama, War",2004,140
241,Before Sunset,"Nine years after Jesse and Celine first met, they encounter each other again on the French leg of Jesse''s book tour.","Drama, Romance",2004,80
242,Munna Bhai M.B.B.S.,A gangster sets out to fulfill his father's dream of becog a doctor.,"Comedy, Drama, Musical",2003,156
243,Salinui chueok,"In a small Korean province in 1986, two detectives struggle with the case of multiple young women being found raped and murdered by an unknown culprit.","Crime, Drama, Mystery",2003,131
244,Dil Chahta Hai,"Three inseparable childhood friends are just out of college. Nothing comes between them - until they each fall in love, and their wildly different approaches to relationships creates tension.","Comedy, Drama, Romance",2001,183
246,Finding Nemo,"After his son is captured in the Great Barrier Reef and taken to Sydney, a timid clownfish sets out on a journey to bring him home.","Animation, Adventure, Comedy",2003,100
247,Catch Me If You Can,"Barely 21 yet, Frank is a skilled forger who has passed as a doctor, lawyer and pilot. FBI agent Carl becomes obsessed with tracking down the con man, who only revels in the pursuit.","Biography, Crime, Drama",2002,141
248,Amores perros,"A horrific car accident connects three stories, each involving characters dealing with loss, regret, and life''s harsh realities, all in the name of love.","Drama, Thriller",2000,154
249,"Monsters, Inc.","In order to power the city, monsters have to scare children so that they scream. However, the children are toxic to the monsters, and after a child gets through, 2 monsters realize things may not be what they think.","Animation, Adventure, Comedy",2001,92
250,"Shin seiki Evangelion Gekijô-ban: Air/Magokoro wo, kimi ni",Concurrent theatrical ending of the TV series Shin seiki evangerion (1995).,"Animation, Action, Drama",1997,87
251,Lagaan: Once Upon a Time in India,The people of a small village in Victorian India stake their future on a game of cricket against their ruthless British rulers.,"Adventure, Drama, Musical",2001,224
252,The Sixth Sense,A boy who communicates with spirits seeks the help of a disheartened child psychologist.,"Drama, Mystery, Thriller",1999,107
253,La leggenda del pianista sull'oceano,"A baby boy, discovered in 1900 on an ocean liner, grows into a musical prodigy, never setting foot on land.","Drama, Music, Romance",1998,169
254,The Truman Show,An insurance salesman discovers his whole life is actually a reality TV show.,"Comedy, Drama",1998,103
255,"Crna macka, beli macor",Matko and his son Zare live on the banks of the Danube river and get by through hustling and basically doing anything to make a living. In order to pay off a business debt Matko agrees to marry off Zare to the sister of a local gangster.,"Comedy, Crime, Romance",1998,127
256,The Big Lebowski,"Jeff The Dude Lebowski, mistaken for a millionaire of the same name, seeks restitution for his ruined rug and enlists his bowling buddies to help get it.","Comedy, Crime, Sport",1998,117
257,Fa yeung nin wah,"Two neighbors, a woman and a man, form a strong bond after both suspect extramarital activities of their spouses. However, they agree to keep their bond platonic so as not to commit similar wrongs.","Drama, Romance",2000,98
258,Trainspotting,"Renton, deeply immersed in the Edinburgh drug scene, tries to clean up and get out, despite the allure of the drugs and influence of friends.",Drama,1996,93
